{
  "id": 249504,
  "resource_url": "https://api.discogs.com/releases/249504",
  "type": "release",
  "title": "Kind Of Blue",
  "thumb": "https://api.discogs.com/releases/249504",
  "artist": "string-value",
  "role": "string-value",
  "year": 1959,
  "format": "string-value",
  "label": "string-value",
  "status": "string-value"
}